{
  "state": "indeterminate",
  "verdict": "run-sheet aborted: step 12 (keys[select_ca_node] the CA's RESULTS-pane row -> Properties (3 x DOWN, ENTER: All Tasks/Refresh/Properties/Help). MEASURED 2026-09-21 and the single most surprising fact on this surface: the same CA in the SCOPE TREE offers no Properties item at all -- its menu is All Tasks/View/Export Lis",
  "envelope_result": {},
  "events": [
    {
      "sequence": 1,
      "from_state": null,
      "to_state": "prepared",
      "reason": "capability certsrv.restrict_certificate_manager prepared over GPO None"
    },
    {
      "sequence": 2,
      "from_state": "prepared",
      "to_state": "armed",
      "reason": "capability certsrv.restrict_certificate_manager invocation started"
    }
  ],
  "provenance": {
    "$schema": "docs/transaction-record-schema-v2.json",
    "schema_version": 2,
    "capability": "certsrv.restrict_certificate_manager",
    "run_sheet": "certsrv.restrict_certificate_manager",
    "transaction_id": "06c804d5-d1e5-4cb9-a90f-86d1dcf4b707",
    "console": {
      "mode": "controller_direct",
      "state": "unlocked",
      "helper_responds": true
    },
    "steps": [
      [
        {
          "index": 0,
          "step": "wait_foreground[open_certsrv_console] MEASURED 2026-09-21: certsrv.msc does not open a frame first. It raises this modal -- 'Cannot manage Active Directory Certificate Services. The system cannot find the file specified. 0x80070002' -- because the snap-in resolves the LOCAL CertSvc configuration and this guest is not a CA. Four command-line target forms were measured and none avoids it, so the modal is part of every launch on this surface rather than a fault to diagnose",
          "ok": true,
          "detail": {
            "matched": true,
            "title": "Microsoft Active Directory Certificate Services",
            "surfaced": true
          }
        },
        {
          "index": 1,
          "step": "click_element[dismiss_local_ca_error] dismiss the console's complaint about itself; the frame behind it is already built, still targeted at (Local)",
          "ok": true,
          "detail": {
            "clicked": [
              365,
              149
            ]
          }
        },
        {
          "index": 2,
          "step": "wait_foreground[open_certsrv_console] the untargeted frame. Asserting (Local) here is deliberate: it is the pre-state the retarget has to move, so a run that somehow started already targeted is caught before the gesture rather than credited with it",
          "ok": true,
          "detail": {
            "matched": true,
            "title": "certsrv - [Certification Authority (Local)]",
            "surfaced": true
          }
        },
        {
          "index": 3,
          "step": "context[open_certsrv_console]",
          "ok": true,
          "detail": {
            "foreground": {
              "class": "ConsoleWindowClass",
              "process_name": "powershell",
              "pid": 1656,
              "uia_digest": "9193a3dfa818177116222e6726568faf1e459eb031086f91eface84216a650ea",
              "rect": {
                "left": 0,
                "bottom": 720,
                "top": 0,
                "right": 1024,
                "height": 720,
                "width": 1024
              },
              "title": "Administrator: C:\\WINDOWS\\System32\\WindowsPowerShell\\v1.0\\powershell.exe",
              "hwnd": 1376570
            },
            "asserted_window": "certsrv - [Certification Authority (Local)]"
          }
        },
        {
          "index": 4,
          "step": "shot baseline surface before anything is retargeted",
          "ok": true,
          "detail": {
            "saved": "/projects/windows-console-driver/runs/cs-console-untargeted.png"
          }
        },
        {
          "index": 5,
          "step": "keys[retarget_console] root node context menu -> Retarget Certification Authority, in ONE composite. The walk is POSITIONAL (1 x DOWN, ENTER: Retarget is item 1 of Retarget/View/Export List/Help, read off a screenshot at authoring time) because MEASURED 2026-09-21: menu mnemonics do not take on this surface, injected either as WM_CHAR or as a VK chord. delay_ms 600 is measured too -- at 250 the keystroke arrived before the menu had rendered and went to the tree as type-ahead",
          "ok": true,
          "detail": {
            "injected_events": 15
          }
        },
        {
          "index": 6,
          "step": "wait_foreground[retarget_console] the Select Computer wizard page. Its title is the bare snap-in name, which is why the selector is anchored to start and end",
          "ok": true,
          "detail": {
            "matched": true,
            "title": "Certification Authority",
            "surfaced": true
          }
        },
        {
          "index": 7,
          "step": "keys[retarget_console] radio and host in ONE invocation: dialog focus resets across invocations, so the click that selects 'Another computer' and the typing that fills the edit beside it cannot be split. The edit has no name of its own until it has content, so it is reached by TAB from the radio rather than by selector",
          "ok": true,
          "detail": {
            "injected_events": 53
          }
        },
        {
          "index": 8,
          "step": "shot qualification checkpoint: the wizard must read the ca_host argument",
          "ok": true,
          "detail": {
            "saved": "/projects/windows-console-driver/runs/cs-retarget-filled.png"
          }
        },
        {
          "index": 9,
          "step": "click_element[retarget_console]",
          "ok": true,
          "detail": {
            "clicked": [
              307,
              334
            ]
          }
        },
        {
          "index": 10,
          "step": "wait_foreground[retarget_console] the retarget's structural proof: the frame title carries the target, so this selector resolves only if the console is now managing the CA the plan named -- and only that one. A wizard that silently kept (Local) fails here, before the sheet is ever opened",
          "ok": true,
          "detail": {
            "matched": true,
            "title": "certsrv - [Certification Authority (LabCA01.ad.labdomain.dev)]",
            "surfaced": false
          }
        },
        {
          "index": 11,
          "step": "shot",
          "ok": true,
          "detail": {
            "saved": "/projects/windows-console-driver/runs/cs-console-targeted.png"
          }
        },
        {
          "index": 12,
          "step": "keys[select_ca_node] the CA's RESULTS-pane row -> Properties (3 x DOWN, ENTER: All Tasks/Refresh/Properties/Help). MEASURED 2026-09-21 and the single most surprising fact on this surface: the same CA in the SCOPE TREE offers no Properties item at all -- its menu is All Tasks/View/Export List/Help and the Action menu agrees -- so the results-pane twin is not a convenience here, it is the only path to the sheet. Results rows on this surface ARE named UIA ListItems, unlike the certtmpl container's virtualized rows, so the row is addressed by name",
          "ok": false,
          "error": "uia_dump was truncated (element or time cap); raise depth or narrow the window"
        }
      ]
    ],
    "cleanup": {
      "ran": true,
      "journal": [
        {
          "index": 0,
          "step": "guest",
          "ok": true,
          "detail": [
            {
              "index": 0,
              "step": "guest",
              "ok": true,
              "detail": {
                "stdout": "remaining=0"
              }
            }
          ]
        },
        {
          "index": 1,
          "step": "guest",
          "ok": true,
          "detail": [
            {
              "index": 0,
              "step": "guest",
              "ok": true,
              "detail": {
                "stdout": "present_before=False\nremoved=False\nabsent_registry=True\nabsent_certutil=True\ncertutil_rc=-2147024894\nresidual="
              }
            }
          ]
        },
        {
          "index": 2,
          "step": "guest",
          "ok": true,
          "detail": [
            {
              "index": 0,
              "step": "guest",
              "ok": true,
              "detail": {
                "stdout": "unregistered=WCDLaunchCertSrv"
              }
            }
          ]
        }
      ]
    },
    "notes": [
      "interactive session lease held: wcd.console:mvmhyperv01.ad.hraedon.com:LabMS01",
      "recovery checkpoint 'domain-joined' present: True"
    ],
    "capability_revision": 1,
    "capability_sha256": "c1df0cc3e16725e9e2ae17d5b50adcb5c6f074c9e8cdb6a8dbb0d1e8bbc08ce7"
  }
}
